source_type,thread_id,comment_id,createdAt_iso,url,engagement,tags_triggered,text_snippet
thread,thread_1351799892257906,,2023-11-08T23:58:12Z,https://www.facebook.com/groups/uncagedcliniciangroup/permalink/1351799892257906/,1182,,"Our Wellness / Health Coaching consent form has been popular. Who would like a copy? Comment ""Me"""
thread,thread_1181834305921133,,2023-02-13T23:17:33Z,https://www.facebook.com/groups/uncagedcliniciangroup/permalink/1181834305921133/,960,,A lot of people have been asking for a WELLNESS/COACHING Consent Form. Who wants a copy?
thread,thread_1661138187990740,,2025-02-07T02:03:57Z,https://www.facebook.com/groups/uncagedcliniciangroup/permalink/1661138187990740/,858,,"After 30 + years “doing” physical therapy here in Phoenix and Scottsdale, including the past 11 yrs and 8 months of my own mobile practice, this was me leaving my final client in Arizona! Been a good, long ride. Excited to create something in Frisco, Texas!"
thread,thread_1266370220800874,,2023-06-21T15:25:20Z,https://www.facebook.com/groups/uncagedcliniciangroup/permalink/1266370220800874/,670,,We updated our new practice owner 10-Step Checklist to give you more help as a new biz owner. Want it? ⬇️
thread,thread_1373710540066841,,2023-12-15T19:43:45Z,https://www.facebook.com/groups/uncagedcliniciangroup/permalink/1373710540066841/,610,,Who in here is FULLY Uncaged? 👇(No longer dependent on another job for income) We are curious and have something cooking 🍳that we believe you are going to love!
thread,thread_1321801021924460,,2023-09-21T11:04:19Z,https://www.facebook.com/groups/uncagedcliniciangroup/permalink/1321801021924460/,576,promo,"13… I have 13 patients scheduled. It has taken 3 solid years of highs and lows, second guessing myself on this journey, and wondering if I made the right move. But 3 years and I hit my target goal of 12/week… 12 was my magic number to average 10/week. 12 would let me do what I set out to do from ..."
thread,thread_1156866198417944,,2023-01-12T00:53:16Z,https://www.facebook.com/groups/uncagedcliniciangroup/permalink/1156866198417944/,540,,"Idk why but this became a place I feel safe to celebrate financial wins. I’m excited!, I do feel like a money launderer (the good kind) that redistributed my income Lol. I need a budgeting class… 2023 goals. These are net numbers. I work 3 -4 days a week, it’s just me in a small clinic and I took..."
thread,thread_1522427331861827,,2024-08-01T13:21:08Z,https://www.facebook.com/groups/uncagedcliniciangroup/permalink/1522427331861827/,534,,"Hi Everyone. A while back I asked for prayers for my 23 weeker twins. Not sure who will see this post, but just wanted to update the group with this recent photo of them. They are hitting most milestones according to their adjusted age and starting to try new foods. One has a pretty strong bottle..."
thread,thread_1317677879003441,,2023-09-14T21:30:11Z,https://www.facebook.com/groups/uncagedcliniciangroup/permalink/1317677879003441/,480,,"NO BRAIN BLEEDS FOR EITHER GIRL!!!!!!! THANK YOU PRAYER WARRIORS!!!! Hi Uncaged Clinicians. Not sure if this is allowed, but we are asking for prayers for our twin girls born last week at 23 weeks. They are receiving great care in the NICU, but we have a big ultrasound test to scan for brain blee..."
thread,thread_1338846913553204,,2023-10-18T17:30:46Z,https://www.facebook.com/groups/uncagedcliniciangroup/permalink/1338846913553204/,465,,I wrote a book 📕 in 2019 that lays out exactly how I grew my cash concierge practice in Denver… Want the PDF version for free? ⬇️
thread,thread_1905862513518305,,2025-11-23T17:13:45Z,https://www.facebook.com/groups/uncagedcliniciangroup/permalink/1905862513518305/,449,,"**There’s been a lot of “noise” lately about physical therapy no longer being labeled a “professional” degree by the Department of Education.** Here’s the reality: **the public doesn’t care—and honestly, it doesn’t change a thing about what we do.** Most patients don’t know (and don’t need to kno..."
thread,thread_1275519943219235,,2023-07-05T20:21:48Z,https://www.facebook.com/groups/uncagedcliniciangroup/permalink/1275519943219235/,440,,We recorded a 15-minute podcast that will help you to sell your cash based services without feeling salesy. Want it?
thread,thread_1215364245901472,,2023-04-04T01:18:46Z,https://www.facebook.com/groups/uncagedcliniciangroup/permalink/1215364245901472/,434,,For those who haven’t jumped ship. Today when I woke I realized my cat was not well (12.5 months of guessing … on meds off meds ..ups and downs). I held him all morning. He had an accident on me. I bathed him. And this decline continued through the day. Based on the way my dog was acting I knew t...
thread,thread_1134700637301167,,2022-12-15T20:26:18Z,https://www.facebook.com/groups/uncagedcliniciangroup/permalink/1134700637301167/,407,,"HUGE OPPORTUNITY COMING ""Uncaged Clinician has the potential to help unite the profession"" We hear this all the time. People looking for connection, community, resources, collaboration, etc. that they're not getting anywhere else in the profession. We're launching something new that we need a SMA..."
thread,thread_1127192501385314,,2022-12-07T17:48:17Z,https://www.facebook.com/groups/uncagedcliniciangroup/permalink/1127192501385314/,401,,What’s your favorite skill or certification you’ve obtained that you use a ton in your practice?
thread,thread_1789895861781638,,2025-07-14T16:19:44Z,https://www.facebook.com/groups/uncagedcliniciangroup/permalink/1789895861781638/,397,,"This is a random question, but is anyone hiring a remote person with PT background? Some of you may remember me as I asked for prayer after my 23 weeker twins were born in 2023. They are doing so well! 🙏I was eager to get my practice up and going this year and now I’m pregnant with twins again so..."
thread,thread_1662333344537891,,2025-02-08T17:22:16Z,https://www.facebook.com/groups/uncagedcliniciangroup/permalink/1662333344537891/,378,,"Hi there! Are you a member of APTA? Why or why not? Thanks! (Full disclosure, I am on the MN APTA board and talking to national APTA to learn why people are not members and how APTA can support the independent PTs. I have always said APTA doesn’t bring value to people like us but I wanted to hear..."
thread,thread_1225791681525395,,2023-04-20T15:13:26Z,https://www.facebook.com/groups/uncagedcliniciangroup/permalink/1225791681525395/,346,script|cta,"PSA - Something to think about when you are wanting to hire a therapist. I'm going to share this comment I made on a job posting on this page. I am not looking for a job, but I was reading the description thinking how it sounded like a great opportunity for someone. And then the last line. Master..."
thread,thread_1455884431849451,,2024-04-23T00:31:04Z,https://www.facebook.com/groups/uncagedcliniciangroup/permalink/1455884431849451/,355,,Just found out our local community college has a capacity of 32 for PTA program. Currently currently enrolled? Nine. (9)
thread,thread_1449925009112060,,2024-04-13T16:22:24Z,https://www.facebook.com/groups/uncagedcliniciangroup/permalink/1449925009112060/,353,,I’m at my daughter’s track meet. Stretch lab is packed and the physical therapy company is empty. #ZoomIn
thread,thread_1711623849608840,,2025-04-08T14:41:15Z,https://www.facebook.com/groups/uncagedcliniciangroup/permalink/1711623849608840/,315,referral,Hey all - I want to introduce to you Bryan M. Laughery. He is a friend and business partner of mine who has a unique opportunity for us all that could make us some extra cash on the side. He is working with a company that serves veterans with their DBQ assessments for disability. Essentially they...
thread,thread_1072359416868623,,2022-10-04T22:09:17Z,https://www.facebook.com/groups/uncagedcliniciangroup/permalink/1072359416868623/,321,,"I paid myself a bonus today. I’ve been working my ass off, going at 100% and finally achieved my goal for a minimum in my bank account ( I’m 2 years old). The bonus was only $1000 but the most I’ve ever gotten from an employer was a $25 Starbucks card so I’ll take this as a big win!"
thread,thread_1614528389318387,,2024-12-04T17:47:27Z,https://www.facebook.com/groups/uncagedcliniciangroup/permalink/1614528389318387/,320,,"Hi team! Sooo…I need a little bit of help from you all! We are hiring! As many of you know. My company provides mobile and in clinic PT, OT and massage therapy services. We have grown and continue to service older adults in the Central Florida area. We specialize in neurological and orthopedic di..."
thread,thread_1758273261610565,,2025-06-05T20:46:54Z,https://www.facebook.com/groups/uncagedcliniciangroup/permalink/1758273261610565/,313,,Life choices lol
thread,thread_1037371593700739,,2022-08-22T00:24:27Z,https://www.facebook.com/groups/uncagedcliniciangroup/permalink/1037371593700739/,308,,Story: I just booked a two week trip for Alaska June 23. Point of my story: Feels so good not to have to ask anyone permission. The End 😊
thread,thread_1915540072550549,,2025-12-05T22:48:51Z,https://www.facebook.com/groups/uncagedcliniciangroup/permalink/1915540072550549/,293,,"I've seen a lot of concern about us losing the title ""professional"". The absolute lowest bar of acting like a professional is being a member of your professional organization. APTA is all over this fight and other fights like it every day, year after year. They protect and maintain our profession..."
thread,thread_1921017248669498,,2025-12-12T20:41:29Z,https://www.facebook.com/groups/uncagedcliniciangroup/permalink/1921017248669498/,288,,Any Christian guys in healthcare who are also into investing or entrepreneurship? Would love to connect—it’s surprisingly hard to find this combo.
thread,thread_1296230347814861,,2023-08-09T11:30:14Z,https://www.facebook.com/groups/uncagedcliniciangroup/permalink/1296230347814861/,258,outcome|result,"For those charging over $200, do you have like, a special niche or group that you market to or would you say you do traditional PT? I'm just starting and I'm having trouble even saying I charge $175 for an eval, much less get people to sign up. I don't want to undersell myself, and I've heard sta..."
thread,thread_1433028657468362,,2024-03-18T16:54:20Z,https://www.facebook.com/groups/uncagedcliniciangroup/permalink/1433028657468362/,267,offer,"Would anyone be interested in a training around the ""hydrogen"" water that's being taken over by social media (Gary Breka, Joe Rogan, etc). I was asked to speak on it for another setting and since I'll have my materials together I figured I could offer to my uncaged people as well. It would includ..."
thread,thread_1292644671506762,,2023-08-03T13:11:26Z,https://www.facebook.com/groups/uncagedcliniciangroup/permalink/1292644671506762/,277,,Just for fun my friends. What could you give a 40-minute presentation on with absolutely no preparation?
thread,thread_1815274985910392,,2025-08-13T21:55:30Z,https://www.facebook.com/groups/uncagedcliniciangroup/permalink/1815274985910392/,276,,A group that’s getting stuff done!!!! no excuses. Let’s go!!!! 🔥🔥🔥🔥
thread,thread_972755196829046,,2022-05-22T17:02:00Z,https://www.facebook.com/groups/uncagedcliniciangroup/permalink/972755196829046/,259,promo,"A friend posted this today in our Leaders Network & I loved it * You graduate college with 100k in debt, people clap and cheer for you. You get married and spend between 5-50k for one day, people will clap and cheer for you. You take a 200k loan from the bank to buy your first house, people will ..."
thread,thread_1297559081015321,,2023-08-11T15:17:42Z,https://www.facebook.com/groups/uncagedcliniciangroup/permalink/1297559081015321/,263,,What have you done this week that you are most proud of?!
thread,thread_1433229660781595,,2024-03-19T01:08:06Z,https://www.facebook.com/groups/uncagedcliniciangroup/permalink/1433229660781595/,261,,"Not sure where else to ask this question, but if someone is a DPT…(I am not) is it legal to just put PT after your name where required? Found out a hospital system is forcing DPTs to drop the D."
thread,thread_1184647118973185,,2023-02-17T15:26:59Z,https://www.facebook.com/groups/uncagedcliniciangroup/permalink/1184647118973185/,260,,"IT’S FRRRRIDAY!!! 🥳 KICK IT UP A NOTCH!! 💪🕺 This is for you, Ray Berardinelli!! 👊🤣"
thread,thread_1039858006785431,,2022-08-25T14:09:31Z,https://www.facebook.com/groups/uncagedcliniciangroup/permalink/1039858006785431/,260,,"How to properly set your “cash” price to reach your practice goals! This was a comment made on a post that seemed to be helpful to others so I will share in more detail here: I don’t think it’s helpful to set your price based on competition in the area, I think it makes a lot more sense to set yo..."
thread,thread_1061600087944556,,2022-09-22T20:13:24Z,https://www.facebook.com/groups/uncagedcliniciangroup/permalink/1061600087944556/,257,,c'mon APTA!! step up and protect our profession from this false advertising!!
thread,thread_1322487758522453,,2023-09-22T15:16:12Z,https://www.facebook.com/groups/uncagedcliniciangroup/permalink/1322487758522453/,241,result,"Just wanted to share a little success. I started my mobile cash based practice as a side gig at the end of July. Still have a full time job in home health but squeeze in what I can, where I can, while keeping work life balance. In two months I’m now averaging around $800/week just on the side whi..."
thread,thread_1746407819463776,,2025-05-21T21:41:51Z,https://www.facebook.com/groups/uncagedcliniciangroup/permalink/1746407819463776/,238,result,"I know none of us is a radiologist, but can anyone take a look at this and confirm or deny what I’m seeing? This is my husbands most recent lumbar MRI. He’s been dealing with moderate to debilitating pain with radicular symptoms to the left leg for almost 18 months now. Before the onset of pain h..."
thread,thread_1216223822482181,,2023-04-05T12:03:20Z,https://www.facebook.com/groups/uncagedcliniciangroup/permalink/1216223822482181/,248,,"Reminder to all! This group is different. We uphold a different standard. We love, serve, care, and lead each other. You can have differing opinions without insulting the other person. Carry on."
thread,thread_1566347777469782,,2024-10-01T15:46:34Z,https://www.facebook.com/groups/uncagedcliniciangroup/permalink/1566347777469782/,246,,When was the last time Medicare has increased reimbursement for PT
thread,thread_1252518188852744,,2023-05-31T15:52:44Z,https://www.facebook.com/groups/uncagedcliniciangroup/permalink/1252518188852744/,246,,I'm curious... How many of you are brand new business owners? 👇
thread,thread_1771999283571296,,2025-06-22T21:58:54Z,https://www.facebook.com/groups/uncagedcliniciangroup/permalink/1771999283571296/,232,referral,"Guess what!!! It’s my turn to say now, I am finally Uncaged! I have way to go but it already feels so good! I have just made this flyer as an announcement! Pls give your feedback. Any tips for marketing and spreading the word to build referral sources? I am in New Jersey and would love to connect..."
thread,thread_1073127310125167,,2022-10-05T17:58:53Z,https://www.facebook.com/groups/uncagedcliniciangroup/permalink/1073127310125167/,240,,Has anyone on here officially switched to performing 100% wellness and/or personal training services? I've heard of PTs who have let their license lapse to do this so they weren't so restricted doing virtual sessions and instruction across state lines. If you're out there I would love to know who...
thread,thread_1333037697467459,,2023-10-09T19:26:49Z,https://www.facebook.com/groups/uncagedcliniciangroup/permalink/1333037697467459/,238,,Who has worked for ATI? would you be willing to give the inside scoop on the company and your experience? Feel free to PM me. I’m moving to Dallas area and don’t want to start a fresh company right now so looking into job opportunities.
thread,thread_1880572939380596,,2025-10-26T02:25:24Z,https://www.facebook.com/groups/uncagedcliniciangroup/permalink/1880572939380596/,223,offer,"I have an employee who is planning to start her own clinic and take some of our patients with her. I was trying to be chill about it as it is a neuro caseload and our bread and butter is hand therapy. I have, though, put a ton of money and effort into building that caseload. Over the last couple ..."
thread,thread_1313967306041165,,2023-09-08T22:52:45Z,https://www.facebook.com/groups/uncagedcliniciangroup/permalink/1313967306041165/,221,cta,"Curious what others think…I believe that timed billing codes is one of the worst things for our profession, and we are basically the only profession that has them. It diminishes our value, and dictates how we treat if we want to make any money. If I have a post op shoulder patient, I can do very ..."
thread,thread_1440776423360252,,2024-03-30T13:20:59Z,https://www.facebook.com/groups/uncagedcliniciangroup/permalink/1440776423360252/,230,,What has been the best thing you have done to get clients and what has been the biggest waste of time?
thread,thread_1109015399869691,,2022-11-15T16:52:32Z,https://www.facebook.com/groups/uncagedcliniciangroup/permalink/1109015399869691/,228,,Hi ! Need PT opinions - I’m a PT ( but not ortho!) I have a friend who fell running 10/23 - R thigh hematoma Went to surgeon who decided against draining 2/2 infection risk - Today 11/15- measurements ( from friend ) Right 7” top of knee to midpoint 22 3/4” around Left 5” top of knee to midpoint ...
thread,thread_1809074909863733,,2025-08-06T16:25:26Z,https://www.facebook.com/groups/uncagedcliniciangroup/permalink/1809074909863733/,227,,"Being Uncaged might mean less money in your pocket (it does for me anyway), but it also means that when camp cancels the last week of summer I can juggle my schedule. Today, it means beach in the morning and a condensed schedule in the afternoon so my kids aren’t melting their brains on screens a..."
thread,thread_1228541431250420,,2023-04-24T21:56:04Z,https://www.facebook.com/groups/uncagedcliniciangroup/permalink/1228541431250420/,217,result,"I only post these things not to brag because my success has been minimal compared to most, but it’s just so I can hopefully help other people drop the imposter syndrome that I was holding onto for a while and realize that there are people out there that really value what we do. I just had a self-..."
thread,thread_1210223223082241,,2023-03-26T16:56:50Z,https://www.facebook.com/groups/uncagedcliniciangroup/permalink/1210223223082241/,207,referral|offer,Hey guys! I have been growing an online running coaching business and I have athletes all over the US. The focus is on a lot of distance running so clearly aches and pains often pop up. I'd love to start a referral list for PTs in different areas and thought it would be great to ask this group! I...
thread,thread_1251437732294123,,2023-05-30T01:04:48Z,https://www.facebook.com/groups/uncagedcliniciangroup/permalink/1251437732294123/,215,referral,"Seeking advice on what to wear as a female, mobile PT. I am a mobile PT. I wear a logo'd t-shirt, jogger (poly/spandex blend / not sweat) pants, and clean/nice tennis shoes when I see clients and when I go to networking events. I feel like it is my ""uniform."" My husband thinks I look unprofession..."
thread,thread_1470406703730557,,2024-05-14T20:41:19Z,https://www.facebook.com/groups/uncagedcliniciangroup/permalink/1470406703730557/,222,,"A little pat on my own back: As of June 1, I will have had my brick and mortar wellness studio open for 1.5 yrs. It's just me in there about 99% of the time. Last year, I averaged 36 visits/month. This year (not counting this month) I've averaged 55 visits/month. All time, I've averaged 41 visits..."
thread,thread_1883012935803263,,2025-10-28T16:41:04Z,https://www.facebook.com/groups/uncagedcliniciangroup/permalink/1883012935803263/,189,script|promo|outcome,This is a big NO!
thread,thread_1791760264928531,,2025-07-16T23:37:11Z,https://www.facebook.com/groups/uncagedcliniciangroup/permalink/1791760264928531/,209,offer,One of our PT’s transitioned to a 40 minute work schedule. He is having trouble finishing his notes at work and is having to do notes at home on weekends for 1-2 hours every weekend. I offered to add in a 20 minute break each day so they can do noted but They asked me if I could block a whole 40 ...
thread,thread_1481986712572556,,2024-06-01T01:13:37Z,https://www.facebook.com/groups/uncagedcliniciangroup/permalink/1481986712572556/,219,,"I'm excited to announce our 3rd Brick and Mortar GeriHab Physical Therapy and Wellness in Kingsport, TN Led by our amazing Clinic Director Dr. K.C. Ogbonnaya If I can do it. And if she can do it. So can you friends!!! Let's go!!! 🔥🔥🔥"
thread,thread_1664599264311299,,2025-02-11T22:35:54Z,https://www.facebook.com/groups/uncagedcliniciangroup/permalink/1664599264311299/,218,,What’s the best way to let this person know they can’t advertise “physical therapy services” without being a PT? And really that physical therapy is a profession and not a service…
thread,thread_1411817329589495,,2024-02-12T23:39:19Z,https://www.facebook.com/groups/uncagedcliniciangroup/permalink/1411817329589495/,217,,"PTs- thoughts on becoming an APTA member? I've heard mixed thoughts and wondering if it worth it. If so, what other dues (chapters) did feel was worth paying for in addition to membership and your state chapter?"
thread,thread_990879208349978,,2022-06-17T19:19:48Z,https://www.facebook.com/groups/uncagedcliniciangroup/permalink/990879208349978/,216,,"Getting the practice going has been extremely stressful, but I just got one hell of a motivator from my first reimbursement from BCBS-UT. They paid me $241 for 1 eval of 5 units, 1 untimed eval code + 4 timed codes of about 10 min each. They are one of the highest payors in UT so I understand all..."
thread,thread_1206662886771608,,2023-03-21T01:46:44Z,https://www.facebook.com/groups/uncagedcliniciangroup/permalink/1206662886771608/,215,,New patient call: “How did you hear about us”? “I was at the casino and I couldnt stand up from my chair and one of your PTs helped me up and gave me a card”
thread,thread_1394753484629213,,2024-01-18T11:59:53Z,https://www.facebook.com/groups/uncagedcliniciangroup/permalink/1394753484629213/,204,review,anyone have any luck getting Google to take down reviews that you've flagged or reported? 🥲She brought down my five star average🤬
thread,thread_1904038997033990,,2025-11-21T12:41:16Z,https://www.facebook.com/groups/uncagedcliniciangroup/permalink/1904038997033990/,178,script|cta|offer,Helppppp…Thoughts on consequences for a clinician who is continually behind on documentation (anywhere from 2 weeks to 1 month behind) that has been given up to 3 warnings. Communication with the business owner (myself) (and patients at times) is also lacking outside of being at the office. I hav...
thread,thread_1467639764007251,,2024-05-10T16:38:08Z,https://www.facebook.com/groups/uncagedcliniciangroup/permalink/1467639764007251/,208,,
thread,thread_1276988706405692,,2023-07-07T22:45:50Z,https://www.facebook.com/groups/uncagedcliniciangroup/permalink/1276988706405692/,207,,I inspired my 16 y/o patient to start a business. He and friend started TODAY!! Home Window washing!! They worked 10-3:30 and each NET $240!!!!!! 🔥🔥🔥🔥🔥
thread,thread_1572498063521420,,2024-10-09T14:54:56Z,https://www.facebook.com/groups/uncagedcliniciangroup/permalink/1572498063521420/,205,,Why’s it so hard to get a signed POC returned?!
thread,thread_1109730383131526,,2022-11-16T13:14:03Z,https://www.facebook.com/groups/uncagedcliniciangroup/permalink/1109730383131526/,202,,Built my “brick and mortar” out of my garage. I call It my she shack clinic. Pictures below. Best pricing/quality on some equipment for just starting off???? Any advice￼???? Do you see anything I am missing??? Portable plinth is on top of the treadmill!!
thread,thread_973645306740035,,2022-05-24T00:53:18Z,https://www.facebook.com/groups/uncagedcliniciangroup/permalink/973645306740035/,202,,"Special Guest, Chelsea Smith, shares her secrets of how she has built a successful practice using OUT OF NETWORK Billing! I'm going live using StreamYard! Before leaving a comment, please grant StreamYard permission to see your name at streamyard.com/facebook"
thread,thread_1845298112908079,,2025-09-18T02:03:47Z,https://www.facebook.com/groups/uncagedcliniciangroup/permalink/1845298112908079/,201,,I know there are plenty of people out there That will tell you that they could help your outpatient business. They can double the amount of evaluations you have in a month ….but let me tell you what I actually more than double your new patients in a month. Turn your waiting room in to a coffee sh...
thread,thread_1349290445842184,,2023-11-04T17:07:23Z,https://www.facebook.com/groups/uncagedcliniciangroup/permalink/1349290445842184/,201,,Just wanted to give a boost of confidence for people on the ledge. I just celebrated my 1st year as a privately owned clinic. I ran the numbers and I treated 2605 appointments over the past 12 months. I am the sole provider and I recently just hired my first support staff member. I am still in aw...
thread,thread_1114063946031503,,2022-11-21T17:14:45Z,https://www.facebook.com/groups/uncagedcliniciangroup/permalink/1114063946031503/,171,script|offer|promo,"Subject: Black Friday and Cyber Monday Hey, All! As someone opening my own mobile practice and knowing that Black Friday and Cyber Monday are coming up soon, I want to keep my eye out for good deals. For example, for me, I need either a laptop or tablet and exercise equipment and I'm hoping subsc..."
