source_type,thread_id,comment_id,createdAt_iso,url,engagement,tags_triggered,text_snippet
thread,thread_1257963078308255,,2023-06-09T01:09:39Z,https://www.facebook.com/groups/uncagedcliniciangroup/permalink/1257963078308255/,93,,"Any of y’all who do group exercise classes…how did you learn how to run them lol. Any advice welcome, any classes or CEUs I’m very interested in! I’m a PWR moves certified PT so I want to feel more comfortable structuring group exercise for people with Parkinson’s 🙌🏻"
thread,thread_1220767398694490,,2023-04-12T22:24:10Z,https://www.facebook.com/groups/uncagedcliniciangroup/permalink/1220767398694490/,93,,Hey group! Just throwing a line out for some advice. This summer I am leaving my clinic for 6 weeks to join my spouse who is stationed overseas with the military. My supervisor would like me to come up with ways to minimize the financial impact to the clinic. I find it slightly odd for me to come...
thread,thread_1123477271756837,,2022-12-03T13:41:10Z,https://www.facebook.com/groups/uncagedcliniciangroup/permalink/1123477271756837/,93,,"Alright everyone, I’m just looking for some advice/ place to rant. I’m ready to start seeing patients. I need to get my NPI and my consents ready but I don’t think that’ll take long, I can do consents this weekend. I’m getting discouraged because the local marketing I’ve done and will continue to..."
thread,thread_1076226379815260,,2022-10-08T22:39:00Z,https://www.facebook.com/groups/uncagedcliniciangroup/permalink/1076226379815260/,93,,Thanks Uncaged for being such a gracious audience this weekend!
thread,thread_996012687836630,,2022-06-24T23:02:24Z,https://www.facebook.com/groups/uncagedcliniciangroup/permalink/996012687836630/,93,,"Are you cash-based, or want to be, but don't right asking people for money? Or, you don't feel right charging the same for Wellness vs ""Skilled"" therapy? I'm going live using StreamYard! Before leaving a comment, please grant StreamYard permission to see your name at streamyard.com/facebook"
thread,thread_1459814581456436,,2024-04-28T22:10:52Z,https://www.facebook.com/groups/uncagedcliniciangroup/permalink/1459814581456436/,82,review,Hi! I’m looking to order business cards. Do you have any reccomendations from where I should order them? I was looking into Vistaprint but their past few reviews were not great 😅. Thanks in Advanced!
thread,thread_1436216587149569,,2024-03-23T16:27:46Z,https://www.facebook.com/groups/uncagedcliniciangroup/permalink/1436216587149569/,92,,My car is probably going to the junkyard😵 just trying to get some opinions on what people have found works best for mobile PT (I have a table I need to fit as well as two child care seats) 😅 TIA!!
thread,thread_1260816271356269,,2023-06-12T22:56:55Z,https://www.facebook.com/groups/uncagedcliniciangroup/permalink/1260816271356269/,82,offer,"Here is a visual of why someone would pay you cash.. no insurance. This is a “not small business” (>1000 employees) a family of 3…. Would have to spend $45,000/ year before insurance kicks in. Why even take the plan out??? Just get major medical and pay the rest yourself. What a joke"
thread,thread_1219636112140952,,2023-04-11T00:55:58Z,https://www.facebook.com/groups/uncagedcliniciangroup/permalink/1219636112140952/,92,,"Super curious…for those of you starting businesses in this group right now/ or wanting to start a business: Are you wanting to start a practice to see patients in person, an online business to serve patients, or both?"
thread,thread_1645635926207633,,2025-01-16T16:54:22Z,https://www.facebook.com/groups/uncagedcliniciangroup/permalink/1645635926207633/,72,review|google review,I am solo PT. Please advise on how to respond to negative Google review. I had discharged this patient 6 months ago and recently she texted me on my work Google voice number asking if it is possible to recover from myofascial pain syndrome. I did not reply. Now she wrote a one star Google review ...
thread,thread_1670673423703883,,2025-02-19T17:22:20Z,https://www.facebook.com/groups/uncagedcliniciangroup/permalink/1670673423703883/,51,cta|referral|review|google review,**Practice for Sale** **Clinic Location: West Florida (Tampa-Sarasota Area)** **Clinic Summary:** Husband and Wife Owned/Lead PTs 80- 90% caseload booked-consistently for the last 2 years Brick and Mortar Hybrid Practice Medicare+Cash ($200 per session) Great local relationships for exclusive ref...
thread,thread_1915613512543205,,2025-12-06T01:31:44Z,https://www.facebook.com/groups/uncagedcliniciangroup/permalink/1915613512543205/,81,review,"Ok, I got a bad review from someone that has never been our patient. It’s a fake review, likely orchestrated by a disgruntled ex-employee (yes, the one who was stealing patients to start her own clinic with). It’s not a HIPPA violation to respond saying that she’s not our patient, is it? Seems li..."
thread,thread_1880173372753886,,2025-10-25T15:41:21Z,https://www.facebook.com/groups/uncagedcliniciangroup/permalink/1880173372753886/,91,,This is just a reality check. If you are a clinician and not directly paid by Medicare and you are being paid by another entity (employer)…this is why the owner should make more money than the employee. Clearing house hack February 2024 and not being paid by Medicare October 2025. I know owners t...
thread,thread_1624459481658611,,2024-12-18T14:01:35Z,https://www.facebook.com/groups/uncagedcliniciangroup/permalink/1624459481658611/,91,,"Red light therapy- I’m in the beginning stages of research and am looking to purchase a wand to use on the face, head and neck. Looking to spend $200-500- are there good ones at this price? Do you have any suggestions? Websites?"
thread,thread_1458267368277824,,2024-04-26T12:44:44Z,https://www.facebook.com/groups/uncagedcliniciangroup/permalink/1458267368277824/,81,discount,"Is anyone using anything that is free (or close to) for documentation? I'm trying to keep start up costs minimal, but maybe then expand into something like Jane. So I'm thinking about using squares free version for scheduling and payments initially, but is there anything basic out there for the d..."
thread,thread_1397697887668106,,2024-01-22T16:33:17Z,https://www.facebook.com/groups/uncagedcliniciangroup/permalink/1397697887668106/,91,,CEU season: what classes are people finding really impactful to their practice? I'm making my con ed goals for the year and looking for new ideas!
thread,thread_1366074137497148,,2023-12-03T01:55:35Z,https://www.facebook.com/groups/uncagedcliniciangroup/permalink/1366074137497148/,81,offer,I currently have a cash-based mobile PT side hustle that I plan on doing full time soon. I was approached by a local PT who has a booming business (>6 month wait list) to work in her office (still be my own biz owner). She mentioned taking 20% of each visit for my patients and 50% of each visit w...
thread,thread_1269426410495255,,2023-07-11T13:15:04Z,https://www.facebook.com/groups/uncagedcliniciangroup/permalink/1269426410495255/,91,,"3 important factors that helped me the most to grow 2 very successful businesses over the past 7 years: 1. Imperfect Action - taking action even when I felt that I didn't have everything perfectly set up. I was led by one leading factor - I have what it takes to help someone significantly, and I'..."
thread,thread_1193021081469122,,2023-02-28T19:53:08Z,https://www.facebook.com/groups/uncagedcliniciangroup/permalink/1193021081469122/,91,,My neighbor today told me “in print” I may need to write out our credentials as PT DPT and not written out as doctor of physical therapy anywhere to avoid being sued by people who could claim I’m a medical doctor lol. Any substance to this that anyone knows of?
thread,thread_1165718850866012,,2023-01-23T20:34:35Z,https://www.facebook.com/groups/uncagedcliniciangroup/permalink/1165718850866012/,91,,Does anyone know a company that puts in ceiling tracks like this?
thread,thread_985454258892473,,2022-06-10T01:17:12Z,https://www.facebook.com/groups/uncagedcliniciangroup/permalink/985454258892473/,91,,What do you all use for exercise programs to give to clients. An afterthought for me! So if you haven’t heard I did it!! Had my first clients today!!
thread,thread_1785355918902299,,2025-07-09T03:09:00Z,https://www.facebook.com/groups/uncagedcliniciangroup/permalink/1785355918902299/,90,,Need recommendations for this patient’s bathroom for them to easily be able to get in and out of shower and not feel like they’re going to slip and fall of the chair while in there. Using a small bench already but doesn’t help and have already tried tub transfer bench; too big doesn’t fit. This p...
thread,thread_1677178783053347,,2025-02-27T17:29:07Z,https://www.facebook.com/groups/uncagedcliniciangroup/permalink/1677178783053347/,90,,"How much are mobile PTs paying their accountant to get their taxes done? I’m in NJ and my wife had some W2s, the typical other forms for mortgage, student loans, etc and paid 1,000"
thread,thread_1615255679245658,,2024-12-05T17:55:51Z,https://www.facebook.com/groups/uncagedcliniciangroup/permalink/1615255679245658/,90,,Anyone hear about this? Any insight as to why and how this works would be great!
thread,thread_1565549127549647,,2024-09-30T15:58:37Z,https://www.facebook.com/groups/uncagedcliniciangroup/permalink/1565549127549647/,90,,"With Q4 starting, we are all thinking about future plans and growth. With the current Medicare proposed cuts for 2025, where do you realistically see the profession in 2, 5, and 10 years? What are you planning to do to combat the potential cuts and remain profitable? Just want to open the discuss..."
thread,thread_1359608361477059,,2023-11-22T00:14:21Z,https://www.facebook.com/groups/uncagedcliniciangroup/permalink/1359608361477059/,80,outcome,"**Success happens over nights - not overnight** It is so easy to get bummed out or to feel like a failure when we see others doing great things in their practices. Two things: 👉 I am willing to bet that when you see those wins, the intention is meant to motivate and inspire you. 👉 The subliminal ..."
thread,thread_1175572899880607,,2023-02-05T16:27:48Z,https://www.facebook.com/groups/uncagedcliniciangroup/permalink/1175572899880607/,90,,"This year has been very challenging for me… Overwhelm…. Underwhelm… Frustration… Boredom…. Overwork…. Underwork… Underpay…. All these emotions/ situations wrapped up in a single day, week, month and starting the year. Getting away from my roots and proven known business concepts has left me paral..."
thread,thread_1160609244710306,,2023-01-16T16:06:19Z,https://www.facebook.com/groups/uncagedcliniciangroup/permalink/1160609244710306/,90,,Was given this by first client this morning! I must say… she’s not wrong! Hope you all are off to a killer Monday!
thread,thread_1094095364695028,,2022-10-29T01:43:59Z,https://www.facebook.com/groups/uncagedcliniciangroup/permalink/1094095364695028/,90,,I got my first ever payment from BCBS and I am so excited that 10 months of paperwork and preparation have paid off!
thread,thread_964841547620411,,2022-05-11T15:52:07Z,https://www.facebook.com/groups/uncagedcliniciangroup/permalink/964841547620411/,90,,Quick question —— Can PTs create an LLC? I’ve been doing some research and it looks like “medical professionals” can’t open a practice using an LLC it has to be an s-corp? Thanks for the insight! EDIT- IM LOCATED IN CALIFORNIA ☀️ 🌴🌊
thread,thread_1925538484884041,,2025-12-18T18:44:02Z,https://www.facebook.com/groups/uncagedcliniciangroup/permalink/1925538484884041/,59,discovery call|funnel|result,"How many of you have used a digital marketing agency and are satisfied with the results? Looking to get into the Meta/Google ads world, but no idea where to start. Hoping to find an affordable marketer who can manage and run the campaigns. I know there are a lot of them out there, and many are no..."
thread,thread_1891416014962955,,2025-11-06T20:49:17Z,https://www.facebook.com/groups/uncagedcliniciangroup/permalink/1891416014962955/,79,review,"Hi, I don’t know if any of you guys have ever used the clinic marketing company called Grow my clinic. I use them over the summer. Had a bad experience with them so then I wrote a review and now the owner of the marketing agency is threatening me. ￼any thoughts ?"
thread,thread_1791833138254577,,2025-07-17T02:07:16Z,https://www.facebook.com/groups/uncagedcliniciangroup/permalink/1791833138254577/,79,referral,"Haven't ever worked in ortho, but try to keep up my ortho knowledge best I can. My 80 year old dad who hikes everyday injured his back pulling out finished plants from the garden and now can't walk without a walker. Sent him to an ortho PT and was told If disc is ruptured he would need surgery. T..."
thread,thread_1737972646973960,,2025-05-10T16:31:12Z,https://www.facebook.com/groups/uncagedcliniciangroup/permalink/1737972646973960/,89,,Those of you who take UHC in network... Good luck!
thread,thread_1714888095949082,,2025-04-11T20:33:48Z,https://www.facebook.com/groups/uncagedcliniciangroup/permalink/1714888095949082/,69,discount|result,"I had an employer ask me about how someone who is an entry level employee or low wage income worker could access my expertise if I don't accept insurance. For so many reasons, I never plan on billing insurance or participating. Just curious if any of you do sliding fee scales based on income leve..."
thread,thread_1689155315189027,,2025-03-14T09:54:18Z,https://www.facebook.com/groups/uncagedcliniciangroup/permalink/1689155315189027/,89,,For those accepting Medicare: What is your average reimbursement for a 4 unit visit?
thread,thread_1400073384097223,,2024-01-26T03:34:15Z,https://www.facebook.com/groups/uncagedcliniciangroup/permalink/1400073384097223/,89,,"Is the grass really greener? Is it though, really? That’s what I wrestle with on a daily basis. I’m currently working full-time in large hospital. It’s standard corporate healthcare, with all of the usual BS. I like my job, though. I get paid relatively well (or so I think). No weekends, no holid..."
thread,thread_1255880098516553,,2023-06-05T23:52:29Z,https://www.facebook.com/groups/uncagedcliniciangroup/permalink/1255880098516553/,89,,"If you are looking to be cash, but not sure people will pay…. Here’s something to think about.. Lesson I shared from an airplane experience over the weekend"
thread,thread_1253624985408731,,2023-06-02T10:25:54Z,https://www.facebook.com/groups/uncagedcliniciangroup/permalink/1253624985408731/,89,,I didn’t sleep a wink last night… Why? Because this is where Josh Payne and I have the privilege of speaking in just a few hours!! LETS KICK IT UP A NOTCH!!! 🕺💪🔥 #sshclive
thread,thread_1169821610455736,,2023-01-29T04:21:19Z,https://www.facebook.com/groups/uncagedcliniciangroup/permalink/1169821610455736/,89,,
thread,thread_1074135633357668,,2022-10-06T19:45:23Z,https://www.facebook.com/groups/uncagedcliniciangroup/permalink/1074135633357668/,89,,This comment from a patient today made my heart smile: Patient: I love that you are so open and willing to talk about sexuality and gender identity. It’s rare to find a Doctor that isn’t either dismissive of me being non-binary or they just choose to dodge the topic entirely. It’s just refreshing...
thread,thread_1065005394270692,,2022-09-26T18:03:17Z,https://www.facebook.com/groups/uncagedcliniciangroup/permalink/1065005394270692/,69,referral|word of mouth,What is the #1 form of marketing that has helped you to grow to a full-time caseload and beyond? Think first 🤔 and ⌨️ below 👇
thread,thread_1013143536123545,,2022-07-18T23:08:13Z,https://www.facebook.com/groups/uncagedcliniciangroup/permalink/1013143536123545/,89,,Not that I’ve claimed it … but very interesting The rib joint next-door can claim they have the best ribs in town but you can’t claim you have the best therapy in town. 🫣🙄🙁😲😵‍💫🥴￼
thread,thread_971329810304918,,2022-05-20T18:32:34Z,https://www.facebook.com/groups/uncagedcliniciangroup/permalink/971329810304918/,89,,What are everyone's thoughts on being an APTA member? Worth the cost?
thread,thread_1918533988917824,,2025-12-09T17:14:41Z,https://www.facebook.com/groups/uncagedcliniciangroup/permalink/1918533988917824/,38,cta|referral|offer|discount|discovery call,"I’ve been connecting with a local DPC/concierge doc, and we want to formally collaborate. She’d like to be able to pipeline her patients to me, but include my service as part of the fee they’re already paying her (so not just a referral, and then they pay for my service). We are trying to figure ..."
thread,thread_1645693996201826,,2025-01-16T18:51:56Z,https://www.facebook.com/groups/uncagedcliniciangroup/permalink/1645693996201826/,78,offer,"Hello! I am going to be offering virtual wellness/training and need an app that, in addition to a library of exercises, has the capability of recording myself doing an exercise, along with the client recording themselves for me to check their form. I've looked into TrueCoach, AC Health, Physitrac..."
thread,thread_1439535896817638,,2024-03-28T16:25:10Z,https://www.facebook.com/groups/uncagedcliniciangroup/permalink/1439535896817638/,88,,"Lets help eachother out. Think hard before answering this - In one sentence, what would be your advice to someone who isn’t fully Uncaged yet, to become fully Uncaged? ⬇️"
thread,thread_1280158409422055,,2023-07-13T00:03:20Z,https://www.facebook.com/groups/uncagedcliniciangroup/permalink/1280158409422055/,78,script,"David hosts special guest, Bill Johnson, PT, DPT, OCS for a discussion about Bill starting a practice for the second time. His first clinic, which he sold over 10 years ago, was a huge success. But, now, his mindset has changed and he sees the need for guidance. Bill will also share his experienc..."
thread,thread_1249218875849342,,2023-05-26T15:58:31Z,https://www.facebook.com/groups/uncagedcliniciangroup/permalink/1249218875849342/,78,offer,"Happy Friday everyone! I’m adding some cool new wellness features to my clinic which include an infrared sauna, sound/vibration in an antigravity chair and compression therapy through therabody…. I want to offer a membership for the wellness services and was curious for any of you doing this how ..."
thread,thread_1157733784997852,,2023-01-13T03:14:51Z,https://www.facebook.com/groups/uncagedcliniciangroup/permalink/1157733784997852/,88,,So we are almost 2 years into our business. Holy moly what a ride! We are now switching from LLC to S-Corp (we are in Ohio). We are converting our 2 indep contractor PTs to employees. Looking to add front office/admin help. We are in works of expanding our business plan with a God size dream with...
thread,thread_981266532644579,,2022-06-03T23:09:22Z,https://www.facebook.com/groups/uncagedcliniciangroup/permalink/981266532644579/,88,,Just wanna say: “Don’t stop!” My practice is 1/3 full. While working full time and doing all of the other things. It’s worth it!
thread,thread_1890430028394887,,2025-11-05T20:18:44Z,https://www.facebook.com/groups/uncagedcliniciangroup/permalink/1890430028394887/,87,,"**Great teaching today by JANE on their AI SCRIBE feature!** Comment ""**REPLAY**"" below if interested!"
thread,thread_1871974390240451,,2025-10-16T16:36:17Z,https://www.facebook.com/groups/uncagedcliniciangroup/permalink/1871974390240451/,87,,"Just broke our all-time record for most revenue for a single appointment! $900, which includes one hour appointment and 2 Hours drive time."
thread,thread_1513577502746810,,2024-07-18T21:50:20Z,https://www.facebook.com/groups/uncagedcliniciangroup/permalink/1513577502746810/,87,,"My business partner and I are hiring an experienced DPT for our mobile, concierge physical therapy and wellness practice in South Houston/Galveston County. We would be a good fit for any therapist looking for: -flexible/self-determined schedule -autonomy and consistency with their patients -the a..."
thread,thread_1492410138196880,,2024-06-17T10:56:57Z,https://www.facebook.com/groups/uncagedcliniciangroup/permalink/1492410138196880/,87,,"Hey guyys, i've seen some people talk about this, but honestly I don't know how I feel about it. I have a PT I work with that's COMT certified and his treatment methods are very different to McKenzie methods. Ive seen posts where is has been mostly COMT PT's bashing MDT PT's but honestly I'm tryi..."
thread,thread_1466484780789416,,2024-05-08T23:09:15Z,https://www.facebook.com/groups/uncagedcliniciangroup/permalink/1466484780789416/,87,,"DRY NEEDLING with guest, Scott Dixon"
thread,thread_1417703232334238,,2024-02-22T14:04:07Z,https://www.facebook.com/groups/uncagedcliniciangroup/permalink/1417703232334238/,87,,"Brick and Mortar clinic owners, What is your Square Footage and how many Therapists do you have working at a time?"
thread,thread_1333763550728207,,2023-10-10T23:35:23Z,https://www.facebook.com/groups/uncagedcliniciangroup/permalink/1333763550728207/,87,,"David Bayliff hosts special guest, James Connelly, PT, DPT. David and James will give inspiration on thinking about making the transition from purely mobile to brick-n-mortar or hybrid. Tonight's show is from a special request! I'm going live using StreamYard! Before leaving a comment, please gra..."
thread,thread_1325042281600334,,2023-09-26T15:12:40Z,https://www.facebook.com/groups/uncagedcliniciangroup/permalink/1325042281600334/,87,,Driving myself batty trying to come up with a name for my cash based aquatic therapy business. I know I'm probably overthinking it. How did you decide on your business's name?
thread,thread_1289455728492323,,2023-07-29T01:32:56Z,https://www.facebook.com/groups/uncagedcliniciangroup/permalink/1289455728492323/,87,,"Looking to switch EMRs! Prompt, Heno, or something else?! What do you recommend?!"
thread,thread_1204737760297454,,2023-03-18T01:59:13Z,https://www.facebook.com/groups/uncagedcliniciangroup/permalink/1204737760297454/,87,,"Friends! I need personal PT help! I was running out to the front yard this evening and while taking a step felt and heard a snap in my L gastroc muscle belly. Immediate pain and I couldn’t put weight on my foot. It’s not my Achilles. Currently I’ve been icing and elevating, have a compression soc..."
thread,thread_1171320976972466,,2023-01-31T02:49:53Z,https://www.facebook.com/groups/uncagedcliniciangroup/permalink/1171320976972466/,87,,"Hello UC friends, I'd love to hear your thoughts. Is it possible to hire a PTA as a 1099 IC?"
thread,thread_1585154992255727,,2024-10-25T18:47:00Z,https://www.facebook.com/groups/uncagedcliniciangroup/permalink/1585154992255727/,67,promo|outcome,"Had a concierge doc call me today to go do an evaluation for someone getting outpatient PT, but wants more at her home. She also wants me to do a home assessment for her. Used ChatGPT to give me an Ada compliant form so I would know what to check and make a form to fill out for fall assessment so..."
thread,thread_1204033050367925,,2023-03-17T02:07:14Z,https://www.facebook.com/groups/uncagedcliniciangroup/permalink/1204033050367925/,77,referral,"Hi everyone! 👋 I’m a mobile outpatient PT located in Texas. I started a group called Rehab Professionals of Texas (PT, OT, SLP) to help make it easier for PTs, OTs and SLPs in Texas to refer to and connect with other clinicians in the state. I don’t benefit financially from people joining - it ju..."
thread,thread_1181665415938022,,2023-02-13T23:03:34Z,https://www.facebook.com/groups/uncagedcliniciangroup/permalink/1181665415938022/,27,referral|word of mouth|offer|discount|promo,What are ways have you partnered your mobile PT practice with local gyms ? I’m meeting w an owner and practicing my sales pitch. I want to find his pain points and see how I can fit in. How can I add value by improving their customer retention and new client conversion ? Ultimately another goal i...
thread,thread_1024524488318783,,2022-08-04T01:16:16Z,https://www.facebook.com/groups/uncagedcliniciangroup/permalink/1024524488318783/,76,offer,"“How much should I pay my employees?” This is always a question that I’m fascinated by the answers people respond with. Without outright saying it the general consensus is to pay what you can get away with. To squeeze profits out of employees. If you’re a business owner, how’d that work out for y..."
thread,thread_1873024636802093,,2025-10-17T20:41:14Z,https://www.facebook.com/groups/uncagedcliniciangroup/permalink/1873024636802093/,86,,"Hi 👋🏼 need some advice on how to tell a patient you can’t see them anymore. He’s a real energy sucker, and I need to protect my mental health. He’s been through a lot and I gave him a contact of a local counselor in our area to work things out with. I’m seeing him for a total knee replacement sin..."
thread,thread_1776100906494467,,2025-06-27T20:25:08Z,https://www.facebook.com/groups/uncagedcliniciangroup/permalink/1776100906494467/,86,,"**AW RITE! AW RITE! AW RITE!** It's FRIDAY! LET'S GOOO! Time to ***KICK IT UP A NOTCH! ***💪 Gotta get the party going by giving a massive LET'S GOOO! to my dude, Bryan Munoz who married his lovely bride, Megan, over the weekend! CONGRATS!!! So happy for you, bro! Jesse Modica hosted the Grand Ope..."
thread,thread_1351759655595263,,2023-11-08T22:09:01Z,https://www.facebook.com/groups/uncagedcliniciangroup/permalink/1351759655595263/,86,,"How do you create breaks in your day? When I was in my mobile practice, I got my breaks driving from client to client. Doing so gave me the opportunity to “get outside”. Now that I spend my days mostly on zooms, I find that I have to be intentional about grabbing a mental refresher. No matter the..."
